{
  "version": "1.0.0",
  "metadata": {
    "design_name": "unknown",
    "source_files": [
      "/home/gzr/LLM4EDA/Benchmark/ChipBench/src/Prob002_extraneous_items_sequence_detect_ref.v"
    ],
    "top_module": "",
    "description": "Parsed from 1 file(s)",
    "generated_by": "parse_to_json.py v1.0",
    "generated_at": "2026-06-28T06:30:00.052506Z"
  },
  "includes": [],
  "defines": [],
  "modules": [
    {
      "name": "RefModule",
      "description": "",
      "parameters": [],
      "ports": [
        {
          "name": "clk",
          "direction": "input",
          "data_type": "wire",
          "width": 1,
          "signed": false
        },
        {
          "name": "rst_n",
          "direction": "input",
          "data_type": "wire",
          "width": 1,
          "signed": false
        },
        {
          "name": "a",
          "direction": "input",
          "data_type": "wire",
          "width": 1,
          "signed": false
        },
        {
          "name": "match",
          "direction": "output",
          "data_type": "wire",
          "width": 1,
          "signed": false
        }
      ],
      "signals": [
        {
          "name": "a_tem",
          "type": "reg",
          "width": 9,
          "signed": false
        },
        {
          "name": "match_f",
          "type": "reg",
          "width": 1,
          "signed": false
        },
        {
          "name": "match_b",
          "type": "reg",
          "width": 1,
          "signed": false
        }
      ],
      "always_blocks": [
        {
          "id": "proc_0",
          "type": "always",
          "sensitivity": [
            {
              "type": "posedge",
              "signal": "clk"
            },
            {
              "type": "negedge",
              "signal": "rst_n"
            }
          ],
          "body": [
            {
              "type": "if",
              "condition": {
                "op": "!",
                "operand": {
                  "ref": "rst_n"
                }
              },
              "then": [
                {
                  "type": "assignment",
                  "lhs": {
                    "ref": "match_f"
                  },
                  "rhs": {
                    "literal": "1'b0"
                  },
                  "blocking": false
                }
              ],
              "else": [
                {
                  "type": "if",
                  "condition": {
                    "op": "==",
                    "left": {
                      "type": "select",
                      "source": {
                        "ref": "a_tem"
                      },
                      "range": {
                        "msb": 8,
                        "lsb": 6
                      }
                    },
                    "right": {
                      "literal": "3'b011"
                    }
                  },
                  "then": [
                    {
                      "type": "assignment",
                      "lhs": {
                        "ref": "match_f"
                      },
                      "rhs": {
                        "literal": "1'b1"
                      },
                      "blocking": false
                    }
                  ],
                  "else": [
                    {
                      "type": "assignment",
                      "lhs": {
                        "ref": "match_f"
                      },
                      "rhs": {
                        "literal": "1'b0"
                      },
                      "blocking": false
                    }
                  ]
                }
              ]
            }
          ]
        },
        {
          "id": "proc_1",
          "type": "always",
          "sensitivity": [
            {
              "type": "posedge",
              "signal": "clk"
            },
            {
              "type": "negedge",
              "signal": "rst_n"
            }
          ],
          "body": [
            {
              "type": "if",
              "condition": {
                "op": "!",
                "operand": {
                  "ref": "rst_n"
                }
              },
              "then": [
                {
                  "type": "assignment",
                  "lhs": {
                    "ref": "match_b"
                  },
                  "rhs": {
                    "literal": "1'b0"
                  },
                  "blocking": false
                }
              ],
              "else": [
                {
                  "type": "if",
                  "condition": {
                    "op": "==",
                    "left": {
                      "type": "select",
                      "source": {
                        "ref": "a_tem"
                      },
                      "range": {
                        "msb": 2,
                        "lsb": 0
                      }
                    },
                    "right": {
                      "literal": "3'b110"
                    }
                  },
                  "then": [
                    {
                      "type": "assignment",
                      "lhs": {
                        "ref": "match_b"
                      },
                      "rhs": {
                        "literal": "1'b1"
                      },
                      "blocking": false
                    }
                  ],
                  "else": [
                    {
                      "type": "assignment",
                      "lhs": {
                        "ref": "match_b"
                      },
                      "rhs": {
                        "literal": "1'b0"
                      },
                      "blocking": false
                    }
                  ]
                }
              ]
            }
          ]
        },
        {
          "id": "proc_2",
          "type": "always",
          "sensitivity": [
            {
              "type": "posedge",
              "signal": "clk"
            },
            {
              "type": "negedge",
              "signal": "rst_n"
            }
          ],
          "body": [
            {
              "type": "if",
              "condition": {
                "op": "!",
                "operand": {
                  "ref": "rst_n"
                }
              },
              "then": [
                {
                  "type": "assignment",
                  "lhs": {
                    "ref": "a_tem"
                  },
                  "rhs": {
                    "literal": "9'b0"
                  },
                  "blocking": false
                }
              ],
              "else": [
                {
                  "type": "assignment",
                  "lhs": {
                    "ref": "a_tem"
                  },
                  "rhs": {
                    "type": "concat",
                    "parts": [
                      {
                        "type": "select",
                        "source": {
                          "ref": "a_tem"
                        },
                        "range": {
                          "msb": 7,
                          "lsb": 0
                        }
                      },
                      {
                        "ref": "a"
                      }
                    ]
                  },
                  "blocking": false
                }
              ]
            }
          ]
        }
      ],
      "assignments": [
        {
          "id": "assign_619",
          "lhs": {
            "ref": "match"
          },
          "rhs": {
            "op": "&&",
            "left": {
              "ref": "match_b"
            },
            "right": {
              "ref": "match_f"
            }
          },
          "blocking": false
        }
      ],
      "instances": []
    }
  ],
  "design_hierarchy": {
    "top": "RefModule",
    "tree": {
      "RefModule": []
    }
  }
}